{
  "ts": "2026-01-16T22:30:00.123Z",
  "v": 1,
  "session_id": "abc12345-6789-def0-1234-567890abcdef",
  "mcp": "qf-pipeline",
  "tool": "step0_start",
  "event": "session_start",
  "level": "info",
  "data": {
    "entry_point": "m2",
    "source_file": "/Users/niklas/Courses/ARTI1000X/amnesplan.md",
    "project_name": "Entry_check_modul2_hv",
    "output_folder": "/Users/niklas/Courses/ARTI1000X/Test/Kunskapskontroll"
  }
}
